27,CPY82527,Builder 3D Printers b.v.,,,,,,Builder 3D Printers b.v._CPY82527,large print volume (700x800x700),"3D printing is not only useful for printing a prototype overnight. Industries like the film industry are using 3D printing all the time. The film industry is using 3D printing to print affordable props. Props are objects/accessories which are used in films. A few examples of props are statues, bones, cars and many other objects.",-,Manufacturer | 3D Printers (>5000$),,AM Hardware,,AM Hardware AM Hardware by Technology Large Format 3D Printer Manufacturer Tech - Desktop Filament Extrusion FFF Tech - Industrial FFF/FDM ,http://builder3dprinters.com/products/,builder3dprinters.com,Wohlers Report 2018,-, 3.1-A32,12.1-G11,,,100% FDM | Outreach English,100% FDM | Outreach English; ORID8252,Print Solutions,-,Netherlands,,2211SH Noordwijkerhout,,"The Netherlands, Smelterij 4, Noordwijkerhout",,,,,,,,Maps,-,,,,,,,,,,,-,,,,,,,"2,450","20,000","17,550",EUR,-,,"Dual Feed Extruder, Colour Mix Software",,No - Simplify3D,"Big Printer, Industry",-,Polymer,,,,,,,,,,,-,,,,,,,,,,,,,,,3,11%,Not in Contact,0:28,2,0:15,1,0:13,1,0,0,0,0,0,0,0,0,0,0,0,0,,
28,CPY82528,"Carbon, Inc.",,,,,,"Carbon, Inc._CPY82528",,"Carbon¨ enables companies to craft what the world needs by combining innovations in software, hardware, and materials to deliver breakthrough products that improve human well-being, transform industries, and change the world.
THE COMPANY WAS FOUNDED IN 2013 AND LAUNCHED ON THE TED STAGE IN 2015, where Co-Founder and Executive Chairman, Dr. Joseph DeSimone, unveiled the scientific breakthrough behind Carbon Digital Light Synthesisª (DLSª) technology for the first time.
Carbon DLS technology fuses light and oxygen to rapidly produce polymer products from a pool of resin. By overcoming limitations of conventional 3D printing, DLS makes it possible to digitally produce parts with unmatched quality and surface finish, and at volumes and speeds never before possible. DLS also empowers designers and engineers to create parts using complex geometries that are impossible to produce using traditional manufacturing methods, opening up new product possibilities. As the worldÕs leading digital manufacturing company, Carbon enables some of the most well-known global brands such as adidas, Riddell, Ford, and Johnson & Johnson to create innovative products with 3D printing technology.
Carbon has customers in 14 countries and is continuing to expand globally in Europe and Asia. The company has more than 500 employees globally and is growing rapidly.",-,Manufacturer | 3D Printers (>5000$),,AM Hardware,,AM Hardware AM Hardware by Technology High Speed 3D Printer Manufacturer Tech - DLP Stereolithography ,https://www.carbon3d.com/,carbon3d.com,Wohlers Report 2018,-, 3.1-H30,11.1-E21,,Formnext 2019,100% SLA | Outreach English,100% SLA | Outreach English; ORID8252,Print Solutions,-,United States,California,Redwood City,,"312 Chestnut St, Redwood City",,info@carbon3d.com,,,,,,Maps,-,,,,,,,,,,,-,,,,,,,"40,000","50,000","10,000",USD,-,,,,Yes,Footwear,-,,Photopolymer (DLP),,,,,,,,,,-,,,,,,,,,,,30?,,,,2,22%,In Contact,1:46,5,0:16,3,0,0,0,0,0,0,0,0,0,0,1:30,2,0,0,,
29,CPY82529,"Carima Co., Ltd.",,,,,,"Carima Co., Ltd._CPY82529",,,-,Manufacturer | 3D Printers (>5000$),,,,,http://carima.com,carima.com,Wohlers Report 2018,-,,12.1-G39,,,100% SLA | Outreach English,100% SLA | Outreach English; ORID8252,Print Solutions,-,South Korea,,,,"Room 801~806, Hanhwa Biz Metro 2, 551-24, Yangcheon-ro, Gangseo-gu, Seoul, 07532, South Korea",,sales@carima.com,+82 2 3663 8877,,,,,Maps,-,,,,,,,,,,,-,,,,,,Byungkeuk Lee (CEO) https://www.tctmagazine.com/tct-events/tct-conference-formnext/carima-to-bundle-recently-launched-Materialise-Magics-software/,,,0,,-,,,,"No - Materialise Magic, Carima Slicer v2","Dental, Jewelry, Medical",-,,Photopolymer,,,,,,,,,,-,,,5,25,26,132,157,170,238,327,360,385,430,1440,2,33%,In Contact,3:17,19,2:22,13,0:55,6,0,0,0,0,0,0,0,0,0,0,0,0,,